event_id,event_name,primary_stress,shock_intensity,financial_stress,workforce_stress,operational_stress,knowledge_stress,network_stress,governance_stress,ethical_burden,slack_consumption_pressure,affected_functions
EV001,Supplier and logistics disruption,network and operational disruption,0.72,0.58,0.54,0.76,0.50,0.92,0.64,0.68,0.78,suppliers logistics inventory alternate routes partner coordination and continuity of critical goods
EV002,Workforce absence and demand surge,human capacity and surge stress,0.78,0.62,0.94,0.70,0.58,0.60,0.70,0.86,0.84,staffing depth workload recovery time scheduling service quality and psychological safety
EV003,Cyber and operational outage,digital operational and knowledge disruption,0.76,0.64,0.66,0.90,0.74,0.62,0.76,0.78,0.82,digital systems backup workflows data access communications continuity and decision records
EV004,Revenue decline and liquidity pressure,financial slack and budget flexibility stress,0.80,0.96,0.70,0.66,0.58,0.60,0.76,0.74,0.88,cash reserves credit access budget flexibility staffing decisions service continuity and solvency
EV005,Infrastructure disruption and maintenance backlog,operational infrastructure and public-capacity stress,0.82,0.74,0.76,0.92,0.64,0.78,0.80,0.82,0.90,maintenance spare parts emergency capacity infrastructure continuity and public services
EV006,Knowledge loss and leadership turnover,institutional memory and governance stress,0.70,0.56,0.66,0.58,0.94,0.60,0.86,0.72,0.78,decision records procedures mentoring context leadership continuity and institutional memory
EV007,Compound slack-depletion disruption,compound financial workforce operational network governance and ethical stress,0.94,0.90,0.92,0.90,0.86,0.88,0.92,0.96,0.96,financial reserves workforce capacity operations knowledge suppliers governance ethics and public trust
