strategy_id,strategy,system_domain,critical_service,base_resilience_value,equity_adjusted_value,service_continuity,redundancy,recovery_speed,adaptive_capacity,equity_protection,cascading_exposure,diagnostic
INF001,Grid Redundancy and Microgrid Expansion,energy infrastructure,maintains power for hospitals shelters water pumping cooling communications and critical facilities,7.382,6.92727,8.7,8.9,8.0,8.2,7.8,3.9,promising but requires infrastructure scenario validation
INF002,Flood-Resilient Transport Retrofit Program,transport infrastructure,protects emergency routes freight corridors transit access evacuation and repair mobility,6.858,6.39714,8.1,7.6,7.8,7.9,7.6,4.1,cascade review needed
INF003,Distributed Backup Water and Pumping Capacity,water infrastructure,maintains safe water pressure treatment pumping storage and sanitation during disruption,7.172,6.75029,8.3,8.5,7.9,8.0,7.9,4.0,cascade review needed
INF004,Cross-Network Monitoring and Dependency Mapping,cross-network governance,improves visibility across power water transport communications hospitals and logistics dependencies,6.998,6.54733,7.9,7.4,8.2,8.6,7.7,3.8,equity protection needs strengthening
INF005,Hybrid Wetland and Stormwater Infrastructure,nature-based and hybrid infrastructure,reduces flood peaks heat stormwater stress and ecological degradation through hybrid grey-green systems,7.04,6.66547,8.0,7.8,7.6,8.4,8.1,3.6,promising but requires infrastructure scenario validation
INF006,Equitable Critical Service Restoration Program,equity and recovery governance,prioritizes restoration for medically vulnerable households shelters public housing schools and essential services,7.444,7.21472,8.4,8.0,8.6,8.1,8.9,3.4,promising but requires infrastructure scenario validation
