strategy_id,strategy,system_domain,resistance,recovery,adaptability,transformability,equity_protection,institutional_capacity,implementation_burden,critical_function,economic_resilience_value,equity_gap,institutional_gap,adjusted_value
ER001,Industrial Diversification and Local Production Program,industrial diversification and regional production,8,8,8.5,8.4,8.1,8.2,3.5,reduces concentrated sector dependence strengthens local production and creates alternative pathways for jobs investment and supply,8.133999999999999,0.20000000000000107,0,8.117999999999999
ER002,Supply Chain Buffer and Redundancy Strategy,supply chain and network resilience,8.6,8.2,7.8,7.4,7.6,8,3.2,builds supplier diversification strategic inventory logistics flexibility network visibility and critical-goods continuity,7.859999999999999,0.7000000000000011,0.1999999999999993,7.792
ER003,Workforce Retraining and Mobility Initiative,labor markets skills and adaptive capacity,7.4,7.9,8.9,8.3,8.4,8.1,3,supports worker transition skills mobility income protection and adaptive capacity under technological sectoral and climate change,8.117,0,0.09999999999999964,8.111
ER004,Countercyclical Stabilization and Public Investment Framework,public finance stabilization and investment,8.5,8.8,8,8,8.3,8.8,3.4,stabilizes demand preserves public services supports infrastructure recovery and invests through downturns,8.327000000000002,0,0,8.327000000000002
ER005,Climate Transition and Just Regional Development Plan,climate transition and regional transformation,7.7,7.8,8.8,9.2,8.8,8.5,3.7,aligns climate transition just transition regional development energy transformation worker support and long-term viability,8.407,0,0,8.407
ER006,Community Finance and Small Business Continuity Fund,local enterprise and community finance,8.1,8.5,8.1,7.9,8.7,8.2,2.9,provides low-burden grants loans technical assistance community finance and continuity support for small firms and local enterprise,8.191,0,0,8.191
