strategy_id,strategy,system_domain,critical_function,base_adaptive_learning_value,monitoring_quality,memory_retention,feedback_use,governance_flexibility,community_knowledge,justice_protection,implementation_reliability,forgetting_pressure,diagnostic
AM001,Ecological Monitoring and Threshold Review,ecological systems,detect ecological change and revise management before threshold crossing,7.138,8.6,8.2,8.1,7.5,7.4,7.5,7.8,3.2,promising but requires implementation and governance validation
AM002,Institutional After-Action Learning System,institutions and governance,convert crisis experience into revised rules funding staffing and accountability,7.251,7.8,8.5,8.3,7.9,7.6,7.8,8.1,3.0,strong adaptive-learning profile with manageable forgetting pressure
AM003,Community Knowledge and Early Warning Network,community resilience,integrate local knowledge lived experience and trusted warning systems,7.404,7.9,8.3,8.0,7.7,9.0,8.8,7.6,2.8,strong adaptive-learning profile with manageable forgetting pressure
AM004,Infrastructure Memory and Maintenance Analytics,infrastructure,preserve asset history failure logs maintenance records and dependency knowledge,7.114,8.4,8.8,8.2,7.4,6.8,7.0,8.4,3.4,justice protection needs strengthening
AM005,Adaptive Governance Decision-Trigger Framework,adaptive governance,link monitoring thresholds to accountable decision triggers and policy revision,7.445,8.1,7.9,8.8,8.7,7.9,8.0,8.0,3.1,strong adaptive-learning profile with manageable forgetting pressure
AM006,Safe-to-Fail Climate Adaptation Pilots,climate adaptation,test bounded adaptation options without exposing communities to uncontrolled harm,7.104,7.7,7.5,7.9,8.2,8.4,8.3,7.3,3.5,forgetting-pressure review needed
