pathway_id,pathway,mean_viability_value,median_viability_value,probability_ranked_first,probability_top_two,probability_bottom_two
SR005,Ecosystem Restoration and Livelihood Diversification,7.67706,7.68088,29.07,51.7,17.13
SR004,Climate-Resilient Food and Water Strategy,7.63441,7.64128,22.1,43.1,21.47
SR006,Public Health Housing and Heat Resilience Compact,7.5994,7.60689,18.07,37.37,28.5
SR003,Inclusive Urban Resilience Transition,7.57984,7.5799,16.27,33.03,30.23
SR002,Circular Regional Production System,7.51166,7.51353,9.5,21.83,42.93
SR001,Distributed Renewable Infrastructure,7.41742,7.41789,5.0,12.97,59.73
