strategy_id,strategy,system_domain,availability,access,stability,quality,adaptive_capacity,equity_protection,resource_depletion_risk,critical_function
FW001,Climate-Smart Irrigation Upgrade,irrigation and agriculture,8.4,7.5,8.1,7.8,8.3,7.4,3.7,improves irrigation efficiency crop reliability water accounting and climate-responsive farm management
FW002,Regional Food Storage and Distribution Network,food logistics and storage,8.1,8.2,8.5,7.5,7.9,8.0,3.1,stabilizes food access through reserves storage cold chains local procurement and distribution redundancy
FW003,Watershed Restoration and Recharge Program,watershed and ecosystem resilience,8.3,7.4,7.9,8.6,8.5,7.7,2.7,restores recharge water quality soil moisture flood buffering and ecological function
FW004,Community Water Governance and Access Reform,water governance and access,7.6,8.8,7.7,8.1,8.7,8.9,2.8,improves allocation legitimacy affordability access rights monitoring and community participation
FW005,Diversified Agroecological Production Program,agroecology and food security,8.0,8.1,8.2,8.4,8.6,8.2,2.9,supports crop diversity soil health local food security biodiversity and adaptive livelihoods
FW006,Safe Water Treatment and Sanitation Resilience Plan,water quality and public health,7.8,8.5,8.1,8.9,8.0,8.6,3.0,protects drinking water sanitation hygiene public health and emergency water safety
