strategy_id,strategy,system_domain,learning_capacity,flexibility,coordination,knowledge_integration,legitimacy,accountability,equity_protection,implementation_burden,critical_function
AG001,Adaptive Pathways and Decision Triggers,adaptive pathways and rule revision,8.6,8.9,7.9,8.1,7.9,8.0,7.8,3.2,links near-term decisions to monitoring thresholds review cycles and future governance triggers
AG002,Polycentric Cross-Scale Coordination Forum,polycentric governance and coordination,8.1,7.8,9.0,8.2,8.1,8.1,8.0,3.4,coordinates local regional national Indigenous scientific community and infrastructure actors
AG003,Community Knowledge Co-Production Platform,knowledge co-production and legitimacy,8.3,7.6,8.0,9.1,8.8,8.3,8.7,3.1,integrates scientific local Indigenous practitioner and lived knowledge into governance decisions
AG004,Monitoring Feedback and Learning System,monitoring feedback and institutional memory,9.0,8.2,8.3,8.6,8.0,8.2,8.1,3.3,converts monitoring after-action evidence and public feedback into changed rules budgets and practice
AG005,Equity Accountability and Rights Safeguard,equity accountability and rights protection,8.1,7.7,7.9,8.4,8.7,9.1,9.2,3.0,protects vulnerable groups due process participation appeals anti-displacement safeguards and accountability
AG006,Responsible Policy Experimentation Portfolio,adaptive management and policy experimentation,8.5,8.8,8.1,8.0,7.7,7.8,7.9,3.5,tests pilots and adaptive management interventions with monitoring safeguards and rollback options
