criterion,definition,measurement_note
protective_effectiveness,Capacity of a strategy to reduce direct harm and protect critical functions,Use hazard reduction service continuity health safety and impact evidence
material_support,Actual funding services infrastructure housing healthcare transport legal support insurance or public capacity provided to affected people,Use budget access benefit coverage infrastructure repair and service indicators
accessible_recovery,Ability of affected people to access aid rebuilding relocation public benefits and recovery services,Use eligibility language disability tenure documentation speed and affordability indicators
governance_inclusion,Depth of participation co-design community authority transparency and public accountability,Use decision records co-determination public review appeal mechanisms and local authority indicators
transformation_potential,Capacity to repair or redesign systems that repeatedly produce vulnerability,Use land use reform housing reform infrastructure investment ecological restoration and anti-lock-in indicators
exposure_reduction,Degree to which future exposure is materially reduced rather than normalized,Use hazard maps repeated loss data heat flood smoke outage and displacement indicators
burden_shift,Degree to which costs risk labor debt displacement surveillance or loss are transferred to vulnerable groups,Higher values are penalized because resilience becomes abandonment risk
implementation_burden,Administrative financial technical political and participation burden required to implement the strategy,Higher values require capacity and sequencing review
