strategy_id,strategy,mean_adaptive_governance_value,median_adaptive_governance_value,probability_ranked_first,probability_top_two,probability_bottom_two
AG005,Equity Accountability and Rights Safeguard,8.37939,8.38356,36.77,61.6,9.77
AG003,Community Knowledge Co-Production Platform,8.34027,8.34499,28.87,53.27,14.2
AG004,Monitoring Feedback and Learning System,8.27754,8.28119,19.23,42.13,19.83
AG002,Polycentric Cross-Scale Coordination Forum,8.10851,8.10803,6.13,15.8,48.63
AG001,Adaptive Pathways and Decision Triggers,8.11042,8.10975,5.67,16.13,47.83
AG006,Responsible Policy Experimentation Portfolio,8.04714,8.04937,3.33,11.07,59.73
