portfolio_id,portfolio,system_domain,critical_function,slack_resilience_value,adjusted_slack_resilience_value,ethical_adjusted_value,financial_slack,workforce_slack,operational_slack,knowledge_slack,network_slack,governance_slack,ethical_safeguards,ethical_burden,implementation_burden,diagnostic
SS001,Cash Reserves and Liquidity Buffer,financial reserves liquidity and budget flexibility,protects essential functions by preventing temporary revenue or cost shocks from forcing destructive cuts insolvency or fire-sale decisions,6.895,6.741,6.26342,9.1,7.2,7.4,7.2,7.0,7.8,7.8,3.0,3.0,workforce-slack review needed
SS002,Workforce Depth and Recovery Time,staffing depth recovery time and human capacity,protects people and function through staffing depth cross-training recovery time workload protection and psychological safety,7.417,7.405,7.03725,7.5,9.2,7.8,8.0,7.5,8.2,9.1,2.6,3.4,strong strategic slack portfolio candidate
SS003,Critical Operations Redundancy,backup systems spare parts and operational continuity,protects critical operations with backup systems spare parts alternate workflows continuity tests and graceful degradation,7.301,7.243,6.66581,7.8,7.8,9.2,7.8,8.0,8.1,8.0,3.1,3.5,strong strategic slack portfolio candidate
SS004,Knowledge Architecture and Institutional Memory,knowledge slack decision records and institutional memory,protects adaptive capacity through documentation mentoring knowledge maps after-action archives decision records and communities of practice,7.347,7.333,6.78422,7.4,8.0,7.6,9.3,7.8,8.5,8.3,2.9,3.3,strong strategic slack portfolio candidate
SS005,Supplier and Partner Optionality,network slack suppliers mutual aid and external options,protects continuity through supplier diversity mutual aid route alternatives partner trust and external coordination capacity,7.367,7.313,6.77469,7.6,7.6,8.3,8.0,9.2,8.3,8.2,3.0,3.6,implementation-burden review needed
SS006,Adaptive Governance and Emergency Decision Space,governance slack decision rights and adaptive rules,protects adaptation by creating emergency authority flexible budgets escalation paths ethical review and accountable decision space,7.491,7.484,6.94566,7.8,8.1,8.0,8.4,8.1,9.1,8.4,2.8,3.2,strong strategic slack portfolio candidate
