system_id,system_name,system_type,critical_function,hidden_risk_score,threshold_distance,maintenance_backlog,public_trust,ecological_memory,climate_pressure,adaptive_capacity,system_memory,monitoring_quality,justice_visibility,exposure,diagnostic
SV001,Urban Stormwater System,infrastructure,flood control drainage mobility housing protection and public health,0.5858,0.4004,0.58,0.52,0.40,0.62,0.48,0.46,0.54,0.48,0.74,high hidden-risk and narrowing threshold-distance concern
SV002,Forest Regeneration Landscape,ecological,forest regeneration watershed protection habitat continuity and fire recovery,0.485,0.512,0.30,0.60,0.66,0.68,0.54,0.62,0.56,0.50,0.70,mixed slow-variable profile requiring monitoring
SV003,Public Health Preparedness System,institutional,surveillance workforce surge capacity communication and equitable care,0.551,0.4412,0.44,0.50,0.42,0.58,0.46,0.48,0.58,0.52,0.76,adaptive-capacity concern
SV004,Regional Food Supply Network,social-ecological,food availability distribution labor production and household security,0.5562,0.436,0.50,0.56,0.48,0.64,0.50,0.50,0.52,0.46,0.72,mixed slow-variable profile requiring monitoring
SV005,Watershed Groundwater System,social-ecological,water security baseflow drought buffering and ecosystem persistence,0.497,0.4928,0.36,0.58,0.60,0.66,0.52,0.58,0.60,0.54,0.68,mixed slow-variable profile requiring monitoring
SV006,Institutional Legitimacy System,institutional,public trust compliance legitimacy accountability and administrative capacity,0.539,0.4748,0.40,0.42,0.38,0.50,0.42,0.44,0.46,0.40,0.62,monitoring and signal-quality concern
SV007,Community Heat Resilience System,community,heat protection health access housing safety and neighborhood coordination,0.5946,0.3972,0.46,0.48,0.44,0.72,0.44,0.50,0.52,0.42,0.78,high hidden-risk and narrowing threshold-distance concern
SV008,Dryland Soil Vegetation System,ecological,soil retention vegetation cover infiltration and livelihood support,0.4918,0.5076,0.28,0.62,0.58,0.70,0.50,0.56,0.54,0.48,0.66,mixed slow-variable profile requiring monitoring
