function_id,ecosystem_function,species_richness,functional_diversity,functional_redundancy,response_diversity,connectivity,ecological_memory,disturbance_exposure,critical_role,functional_resilience_profile,function_threshold_risk_index,diagnostic
F001,Pollination,0.72,0.6,0.52,0.49,0.54,0.5,0.72,plant reproduction crop support and habitat renewal,0.45059999999999995,0.522,Redundancy or response-diversity concern
F002,Nutrient Cycling,0.68,0.74,0.66,0.61,0.58,0.7,0.56,nitrogen phosphorus carbon and soil fertility regulation,0.5766,0.39,Mixed profile requiring monitoring
F003,Predation Regulation,0.58,0.63,0.48,0.44,0.5,0.45,0.64,population regulation food-web balance and pest control,0.4191000000000001,0.537,Redundancy or response-diversity concern
F004,Seed Dispersal,0.62,0.57,0.5,0.46,0.47,0.52,0.66,plant regeneration migration and forest recovery,0.4248,0.5332,Redundancy or response-diversity concern
F005,Soil Formation,0.66,0.7,0.62,0.59,0.55,0.68,0.58,soil structure organic matter and water retention,0.5463,0.4178,Mixed profile requiring monitoring
F006,Water Filtration,0.64,0.68,0.58,0.55,0.6,0.63,0.62,nutrient removal sediment trapping and water quality,0.5190000000000001,0.44439999999999996,Mixed profile requiring monitoring
F007,Carbon Storage,0.6,0.64,0.54,0.5,0.52,0.66,0.7,biomass soil carbon peat storage and climate regulation,0.4746,0.49119999999999997,High disturbance exposure
F008,Disturbance Recovery,0.7,0.69,0.61,0.63,0.64,0.72,0.68,regeneration succession refugia and post-disturbance renewal,0.5616,0.41200000000000003,Mixed profile requiring monitoring
