criterion,definition,measurement_note
adaptive_capacity,Ability to adjust behavior operations investments rules and relationships as conditions change,Use flexibility indicators institutional learning monitoring action cycles and pathway options
buffering_capacity,Ability to absorb disturbance through redundancy slack diversity reserves and ecological buffers,Use backup capacity spare resources modularity reserve margins diversity and recovery buffers
transformability,Ability to redesign structures when current systems become unsafe unjust or unsustainable,Use transition pathways policy reform finance governance innovation and anti lock in indicators
governance_quality,Ability of institutions to coordinate learn revise rules include affected people and remain legitimate,Use participation accountability corrective action transparency coordination and legal flexibility indicators
equity_performance,Ability to reduce unequal exposure recovery burden and decision exclusion,Use disaggregated exposure recovery participation affordability access displacement and rights indicators
digital_resilience,Ability of data software sensors cyber physical systems and digital public infrastructure to fail safely,Use cyber posture fallback readiness model validation data governance and continuity indicators
climate_readiness,Ability to prepare for heat flood drought wildfire storms sea level rise and compound climate stress,Use climate exposure scenarios adaptation investment ecological buffers and critical service indicators
systemic_exposure,Remaining exposure to compound cascading networked or planetary risk,Higher values are penalized because exposure reduction remains incomplete
implementation_burden,Administrative technical political financial institutional and participation burden,Higher values are penalized because implementation may exceed current capacity
