strategy_id,strategy,horizon_scanning,weak_signal_detection,stress_testing,adaptive_pathways,participation,data_modeling,governance_integration,equity_sensitivity,transformation_potential,scenario_design_risk,implementation_burden
RSF001,Horizon Scanning and Weak Signal System,9.3,9.2,8.0,8.1,8.2,8.5,8.3,8.0,7.8,2.8,3.2
RSF002,Compound Risk Stress Testing,8.0,8.2,9.4,8.5,8.0,8.8,8.4,8.1,8.0,2.9,3.5
RSF003,Adaptive Pathways and Trigger Framework,8.2,8.4,8.5,9.4,8.3,8.5,8.9,8.5,8.7,2.7,3.7
RSF004,Participatory Community Futures Lab,8.5,8.6,8.1,8.2,9.5,7.8,8.6,9.3,8.9,2.6,3.8
RSF005,Climate Resilience Scenario Portfolio,8.6,8.5,8.9,8.8,8.4,8.9,8.7,8.8,8.6,2.8,3.7
RSF006,Backcasting for Just Transformation,8.2,8.1,8.0,8.6,9.2,8.0,8.8,9.5,9.6,2.6,3.9
RSF007,Scenario Governance and Learning Cycle,8.8,8.7,8.4,8.9,8.7,8.4,9.4,8.9,8.8,2.5,3.6
