strategy_id,strategy,system_domain,critical_function,base_resilience_value,equity_adjusted_value,threshold_risk,legitimacy,capacity,flexibility,coordination,learning,accountability,equity_protection,implementation_burden,diagnostic
IR001,Crisis Coordination Reform,coordination and emergency governance,clarifies authority improves interagency coordination reduces duplication and strengthens crisis decision pathways,7.734,7.21428,0.4,7.8,8.3,7.6,8.8,7.9,7.7,7.6,3.2,equity protection needs strengthening
IR002,Public Trust and Transparency Initiative,legitimacy and public communication,improves transparency public communication uncertainty explanation complaint response and institutional trust,7.558,7.17708,0.9,8.9,7.1,7.0,7.2,7.4,8.5,8.2,2.8,administrative capacity needs strengthening
IR003,Decentralized Adaptive Governance Model,adaptive governance and local discretion,allows local adaptation experimentation scenario learning and frontline discretion with oversight,7.791,7.3547,0.6,7.9,7.4,8.9,7.8,8.6,7.6,8.0,3.4,implementation burden review needed
IR004,Administrative Capacity and Training Program,administrative capacity and implementation,builds staffing expertise procurement data systems field operations and implementation competence,7.442,6.87938,0.8,7.2,8.8,7.3,7.5,8.1,7.4,7.3,3.1,equity protection needs strengthening
IR005,Equity and Access Accountability Review,equity accountability and administrative justice,reduces administrative burden audits access and enforcement equity strengthens rights protection and participation,7.947,7.74674,0.5,8.3,7.5,7.8,7.6,7.9,8.9,9.1,3.0,promising but requires institutional scenario validation
IR006,Institutional Learning and After-Action Implementation System,learning memory and institutional reform,converts crisis lessons audits near misses and public feedback into funded rule and practice changes,8.039,7.61133,0.2,7.8,8.0,8.2,8.4,9.0,8.4,8.1,3.3,implementation burden review needed
