event_id,event_name,system_domain,disturbance_intensity,monitoring_signal,lesson_capture,implementation_followthrough,community_input,justice_visibility,memory_loss_risk
LM001,Urban flood after-action review,infrastructure and governance,0.76,0.82,0.70,0.58,0.62,0.55,0.38
LM002,Wildfire landscape recovery review,ecological systems,0.84,0.78,0.76,0.64,0.70,0.60,0.42
LM003,Hospital surge staffing review,public health,0.81,0.80,0.68,0.54,0.58,0.63,0.46
LM004,Community heat warning revision,community resilience,0.72,0.74,0.72,0.66,0.86,0.79,0.30
LM005,Digital outage incident review,digital infrastructure,0.69,0.77,0.64,0.60,0.45,0.48,0.44
LM006,Watershed drought adaptation review,social-ecological systems,0.79,0.75,0.78,0.63,0.73,0.68,0.36
