system_id,system,system_context,initial_function,physical_robustness,monitoring_value,predictive_maintenance,cyber_physical_security,redundancy,governance,equity_performance,ecological_adaptation,initial_backlog,initial_operator_strain,critical_function
IIS001,Sensor-rich but undermaintained water system,strong sensing but weak repair capacity and high backlog,0.80,0.54,0.86,0.58,0.56,0.50,0.58,0.54,0.58,0.74,0.64,tests whether monitoring without maintenance investment reduces or merely reveals water-system fragility
IIS002,Automated grid with cyber-physical exposure,high automation and grid visibility with weak OT security and moderate redundancy,0.84,0.70,0.78,0.70,0.48,0.62,0.62,0.56,0.60,0.58,0.60,tests whether automation and grid intelligence become cyber-physical vulnerability under attack
IIS003,Digital twin transit network with equity gaps,advanced modeling and operations analytics with unequal service protection,0.82,0.66,0.82,0.74,0.68,0.60,0.60,0.46,0.56,0.62,0.58,tests whether digital twins and routing intelligence address or obscure mobility inequality
IIS004,Climate-adapted distributed infrastructure system,strong climate adaptation redundancy and ecological buffers,0.83,0.78,0.80,0.78,0.72,0.82,0.80,0.82,0.86,0.38,0.42,tests distributed adaptation microgrids green infrastructure and critical-service protection under climate stress
IIS005,Balanced intelligent infrastructure system,strong monitoring maintenance security redundancy governance equity and ecology,0.87,0.84,0.84,0.86,0.86,0.84,0.86,0.84,0.82,0.30,0.34,tests balanced intelligent infrastructure resilience under repeated compound disruption
IIS006,Vendor-dependent smart city platform,strong dashboards but weak public data rights and portability,0.81,0.68,0.86,0.72,0.64,0.58,0.50,0.52,0.54,0.56,0.62,tests vendor lock-in cloud outage data-rights and public accountability risk
