system_id,system,system_domain,baseline_function,hazard_exposure,chronic_stress,social_capital,institutional_capacity,infrastructure_access,economic_security,information_quality,adaptive_capacity,equity_sensitivity,dependency_coupling,critical_function
SYS001,Neighborhood Mutual Aid and Care Network,social care and mutual aid,0.80,0.70,0.60,0.84,0.68,0.62,0.64,0.70,0.76,0.88,0.64,neighbor check-ins food sharing medication support elder care language access and immediate local response
SYS002,Local Governance and Emergency Coordination System,institutional capacity,0.78,0.72,0.66,0.68,0.76,0.70,0.66,0.72,0.74,0.80,0.74,resource allocation emergency operations public communication recovery planning and interagency coordination
SYS003,Community Infrastructure and Resilience Hub Network,infrastructure and public space,0.76,0.80,0.64,0.70,0.70,0.80,0.62,0.68,0.72,0.86,0.78,cooling charging water supplies shelter communications device support and public gathering during disruption
SYS004,Local Livelihood and Small Business System,economic resilience,0.74,0.68,0.72,0.66,0.64,0.62,0.76,0.62,0.68,0.82,0.66,jobs local businesses income continuity procurement credit childcare transport and recovery capacity
SYS005,Community Information and Trusted Messenger Network,information and trust,0.82,0.66,0.58,0.78,0.68,0.66,0.62,0.84,0.74,0.78,0.60,multilingual warnings trusted messengers local media public meetings risk communication and rumor correction
SYS006,Social-Ecological Stewardship System,ecological resilience and place,0.77,0.82,0.70,0.72,0.66,0.74,0.66,0.68,0.78,0.88,0.70,wetlands canopy watersheds public land food systems cultural places and ecological buffers
