criterion,definition,measurement_note
exposure_reduction,Reduction in people assets services and ecosystems placed in hazard-prone areas,Use heat flood coastal wildfire pollution and critical-service exposure mapping
vulnerability_reduction,Reduction in social health housing economic and environmental susceptibility to harm,Use housing quality income health disability age service access energy burden and historical disinvestment indicators
service_continuity,Ability to maintain or restore essential urban services during disruption,Use water power transit sanitation health cooling communications food access shelter and emergency response metrics
adaptive_capacity,Ability to learn update rules finance interventions revise standards and adjust as conditions change,Use monitoring implementation budgets flexible planning community participation and institutional learning evidence
ecological_buffering,Contribution of green blue and hybrid infrastructure to reducing heat flood air-quality and water stress,Use tree canopy wetlands soils parks permeable surfaces biodiversity and maintenance indicators
equity_protection,Extent to which resilience investments protect vulnerable residents and avoid displacement,Use disaggregated exposure recovery participation housing security anti-displacement safeguards and accessibility data
maladaptation_risk,Risk that an intervention transfers risk creates false security displaces residents increases emissions or excludes groups,Higher values should trigger maladaptation review and safeguards
