criterion,definition,measurement_note
prevention,Capacity to reduce avoidable disease injury exposure and vulnerability before shocks,Use immunization sanitation environmental protection chronic disease prevention housing safety and health-promotion evidence
detection,Capacity to identify threats early and maintain situational awareness,Use surveillance completeness laboratory turnaround wastewater monitoring reporting coverage data integration and community reporting
service_continuity,Capacity to maintain essential public health and healthcare services during disruption,Use emergency care primary care maternal care medication vaccination dialysis mental health laboratory and public-health service continuity
workforce_capacity,Capacity to sustain trained protected supported workers during routine operations and surge,Use staffing vacancies training safety absenteeism burnout retention cross-training and surge capacity data
adaptive_governance,Capacity to coordinate finance learn revise policy and act under uncertainty,Use legal authority coordination budgets after-action implementation data governance procurement and public accountability
trust,Capacity to communicate credibly and enable public action through legitimacy,Use trusted messengers language access communication reach community partnership misinformation monitoring and public confidence
equity_protection,Extent to which resilience protects vulnerable populations and fair access,Use disaggregated outcomes service access recovery resource distribution participation disability access and exposure data
implementation_burden,Administrative logistical financial and political burden required to implement a strategy,Higher values should trigger implementation feasibility review and capacity planning
