profile,mean_function,min_function,final_function,mean_memory,final_memory,mean_adaptive_capacity,mean_justice_adjusted_function
Strong Community Memory,0.99585,0.89549,1.0,0.05216,0.0,0.35739,0.961
Balanced Adaptive Management,0.99581,0.89844,1.0,0.02738,0.0,0.35973,0.94104
High Learning and Strong Memory,0.99808,0.91922,1.0,0.07005,0.0,0.44474,0.92322
Good Monitoring but Weak Governance,0.77676,0.514,0.514,0.01556,0.0,0.17058,0.71074
High Forgetting and Low Feedback Use,0.37437,0.0,0.0,0.00468,0.0,0.12246,0.35004
