strategy_id,strategy,system_domain,critical_function,local_resilience_value,adjusted_local_resilience_value,equity_adjusted_value,liquidity_support,workforce_capacity,supply_resilience,digital_readiness,public_capacity,community_wealth,equity_access,inequality_risk,implementation_burden,diagnostic
LE001,Emergency Microgrant and Liquidity Fund,rapid liquidity emergency grants and cash runway protection,provides fast low-burden support before temporary disruption becomes permanent closure or predatory borrowing,7.363,7.327,6.86821,9.2,7.4,7.2,7.4,8.3,7.5,8.6,2.8,3.0,workforce-capacity review needed
LE002,Community Development Finance and Patient Capital,CDFI community banking credit unions and patient capital,expands fair relationship-based capital for firms excluded by conventional lending and weak collateral systems,7.586,7.556,7.14753,8.7,7.5,7.6,7.5,8.4,8.7,8.9,2.7,3.5,workforce-capacity review needed
LE003,Local Procurement and Anchor Institution Access,anchor procurement local purchasing and contract access,connects small firms to stable demand from public agencies hospitals universities schools utilities and large employers,7.594,7.55,7.02597,7.6,7.8,8.6,7.8,8.8,8.8,8.4,3.0,3.6,strong local resilience strategy candidate
LE004,Small Business Continuity and Digital Resilience Support,business continuity cyber readiness and digital operations,helps firms maintain records payments communications online visibility cybersecurity and alternate operating modes during disruption,7.375,7.315,6.77467,7.8,7.6,7.8,9.1,8.2,7.6,8.2,3.1,3.2,inequality-risk review needed
LE005,Commercial Anti-Displacement and Ownership Strategy,local ownership commercial stabilization and anti-displacement,protects long-standing firms from rent shocks speculative redevelopment property loss and displacement after recovery investment,7.468,7.42,7.0005,7.4,7.8,7.7,7.2,8.6,9.1,8.8,2.9,3.7,implementation-burden review needed
LE006,Workforce Childcare and Local Skills Resilience,workforce capacity care infrastructure and local skills,protects local labor capacity through childcare transit training job quality scheduling stability and worker-centered resilience,7.454,7.406,6.97396,7.2,9.2,7.5,7.4,8.5,8.0,8.7,2.8,3.6,liquidity-support review needed
