event_id,event_name,primary_stress,shock_intensity,supplier_failure,logistics_disruption,demand_surge,inventory_depletion,cyber_disruption,climate_pressure,labor_disruption,coordination_stress,equity_burden,affected_functions
EV001,Port closure and inland logistics congestion,port chokepoint and route disruption,0.86,0.62,0.94,0.72,0.82,0.66,0.70,0.72,0.82,0.76,ports rail trucking warehouses customs delivery schedules and retail inventory
EV002,Upstream supplier failure in concentrated critical input,single-source supplier failure,0.88,0.94,0.70,0.76,0.86,0.70,0.62,0.66,0.78,0.82,critical components production schedules substitute inputs and supplier qualification
EV003,Cyber outage affecting tracking customs and warehouse systems,digital platform and cyber disruption,0.82,0.66,0.76,0.70,0.74,0.94,0.58,0.64,0.82,0.72,visibility customs payments warehouse management tracking allocation and coordination
EV004,Climate disaster damaging infrastructure and cold chains,climate infrastructure and essential goods disruption,0.90,0.74,0.86,0.84,0.88,0.70,0.96,0.80,0.86,0.92,ports roads power cold chain food medicine water inputs worker safety and public services
EV005,Compound demand surge supplier failure and logistics disruption,compound supply network stress,0.94,0.90,0.90,0.92,0.92,0.84,0.88,0.88,0.92,0.96,essential goods critical components prices labor supplier finance infrastructure and public legitimacy
