strategy_id,strategy,system_domain,architecture,redundancy,observability,cybersecurity,data_integrity,maintainability,governance,human_safeguards,vendor_contingency,technical_debt_risk,implementation_burden,critical_function
TR001,Critical Function and Dependency Mapping,dependency visibility critical functions and single-point-of-failure mapping,8.5,8.2,8.6,8.0,8.1,8.2,8.7,8.1,8.2,3.1,3.0,maps critical services vendors APIs data pipelines identity systems infrastructure people and single points of failure
TR002,Graceful Degradation and Fallback Architecture,resilient architecture modularity fallback and graceful degradation,9.2,8.8,8.4,8.2,7.8,8.3,8.4,8.5,8.0,3.0,3.4,preserves essential functions when nonessential features cloud services APIs or components fail
TR003,Cyber Recovery and Tested Backup Program,cyber resilience incident response and restoration,8.0,8.9,8.5,9.2,8.4,8.1,8.6,8.0,7.9,3.2,3.5,protects continuity through detection containment identity security isolated backups restoration drills and incident governance
TR004,Data Integrity and Lineage Governance,data resilience provenance validation privacy and auditability,8.0,7.8,8.6,8.1,9.3,8.2,8.8,8.2,7.8,3.0,3.4,protects trustworthy data through validation lineage metadata privacy controls audit trails and recovery procedures
TR005,Technical Debt and Maintainability Program,software maintainability documentation refactoring and stewardship,8.4,7.8,8.2,8.2,8.0,9.2,8.5,8.3,7.8,2.6,3.7,reduces fragility through documentation tests ownership maps dependency inventories patch governance and refactoring capacity
TR006,Vendor Portability and Platform Contingency Planning,cloud platform vendor API and portability resilience,8.2,8.6,8.0,8.3,8.2,8.0,8.7,8.0,9.2,3.1,3.6,protects service continuity through data portability exit plans alternate vendors contract review and migration readiness
TR007,Human-Centered Fallback and Accessibility Program,user access operator judgment and public-service continuity,8.0,8.1,8.3,8.0,8.2,8.1,8.6,9.2,7.8,2.9,3.3,protects users and operators through accessible fallback procedures manual workarounds appeal paths and worker sustainability
