indicator,definition,measurement_note
maintenance_backlog,Accumulated repair and reinvestment need,Track by asset criticality service dependency climate exposure and equity
public_trust,Confidence in institutions communication and legitimacy,Measure with surveys participation compliance complaint data and qualitative evidence
ecological_memory,Stored recovery capacity in organisms soils seed banks refugia and landscape structure,Measure through recruitment habitat refugia biodiversity soil and disturbance history
climate_pressure,Changing climate baseline affecting hazards and recovery,Track heat drought rainfall sea level fire weather soil moisture and pest pressure
adaptive_capacity,Ability to learn adjust mobilize resources and preserve function,Measure diversity redundancy slack trust resources governance flexibility and response speed
system_memory,Stored institutional ecological cultural or technical knowledge,Track records experienced personnel local knowledge ecological refugia and after-action learning
monitoring_quality,Ability to detect slow change before crisis,Assess data coverage signal timeliness local knowledge integration and actionability
justice_visibility,How clearly unequal exposure and slow harm are seen and acted upon,Use disaggregated vulnerability exposure access participation and repair indicators
exposure,Degree to which a system or population is positioned in harm's way,Track hazard exposure economic vulnerability housing conditions health burden and infrastructure risk
