strategy_id,strategy,system_domain,capital_strength,liquidity_resilience,infrastructure_robustness,governance_capacity,inclusive_resilience,systemic_exposure,implementation_burden,critical_function
FR001,Higher Capital and Liquidity Buffers,capital liquidity and loss absorption,8.9,8.8,7.6,8.3,7.4,3.9,3.2,strengthens solvency liquidity and loss absorption before credit market or confidence shocks become systemic
FR002,Expanded Systemwide Stress Testing,macroprudential stress testing and early warning,7.8,8.3,8.0,8.6,7.6,4.0,3.1,reveals hidden capital liquidity market cyber climate and contagion vulnerability under adverse scenarios
FR003,Resolution Planning and Bail-In Readiness,resolution planning and critical function continuity,8.0,7.7,8.2,8.8,7.5,4.1,3.6,prepares failing institutions to be resolved while preserving deposits payments clearing lending and other critical functions
FR004,Payment and Clearing Infrastructure Hardening,market infrastructure operational resilience and cyber continuity,7.4,7.8,9.2,8.5,7.8,3.8,3.5,protects payment clearing settlement market data central-counterparty and operational systems under disruption
FR005,Non-Bank Financial Intermediation Oversight,non-bank financial intermediation and shadow-risk monitoring,7.5,7.6,7.8,8.4,7.7,4.4,3.7,tracks liquidity mismatch leverage redemption pressure private credit opacity margin calls and regulatory perimeter risk
FR006,Inclusive Finance and Household Balance Sheet Resilience,household small-firm and community financial resilience,7.2,7.4,7.4,8.1,9.2,4.0,3.0,protects households small firms underserved regions fair credit payment access insurance savings and recovery finance
